,user,text,cleaned_text,Sentiment_Polarity,Expression Label
1438,GJRboston,@Biden_Army @zafarwestern @JoeBiden cuz he'll be on his way to Moscow,bidenarmy zafarwestern joebiden cuz hell way moscow,0.0,Neutral
1439,robert_strate,@RichardGrenell @RealJamesWoods @JoeBiden Democrats say vote early vote often!,richardgrenell realjameswoods joebiden democrat say vote early vote often,0.1,positive
1440,cmb19732,RT @RichardGrenell: . @JoeBiden just said mail in ballots aren’t corrupt.   Here’s proof they are. These two people have been dead for 10 y…,rt richardgrenell joebiden said mail ballot corrupt proof two people dead ,-0.35,negative
1441,tishtriya,"RT @shubh19822: Back in 1992, Joe Biden made sure that India does not get access to cryogenic tech   #JoeBiden termed an Indo-Russia agreem…",rt shubh back joe biden made sure india get access cryogenic tech joebiden termed indorussia agreem ,0.25,positive
1442,utorgersen,"RT @WalshFreedom: I’m a conservative. I believe @realDonaldTrump is unfit. Therefore, I’m voting for the ONLY person who can beat Trump, @J…",rt walshfreedom conservative believe realdonaldtrump unfit therefore voting person beat trump j ,0.0,Neutral
1443,sjsadow,RT @BrianKarem: Good morning. In the news: the Taliban endorses @realDonaldTrump while Scientific American endorses @JoeBiden ... wait. Wha…,rt briankarem good morning news taliban endorses realdonaldtrump scientific american endorses joebiden wait wha ,0.35,positive
1444,KPenniall,"RT @ewarren: There’s nothing like New England in the fall, especially during an election cycle!   Had a great day on the trail talking to v…",rt ewarren nothing like new england fall especially election cycle great day trail talking v ,0.31212121212121213,positive
1445,CATNAPPER2020,@HRHAdeyemiAdams @KamalaHarris @ResistsBob @JoeBiden Yeah so trust Biden who was part of Obamacare that made everyt… https://t.co/3VIS3wYgPC,hrhadeyemiadams kamalaharris resistsbob joebiden yeah trust biden part obamacare made everyt httpstcoviswygpc,0.0,Neutral
1446,SilowCarroll,"RT @julianzelizer: Just to be clear, conservatives are complaining that @JoeBiden won’t take a position on changing the size of SCOTUS—whic…",rt julianzelizer clear conservative complaining joebiden take position changing size scotus whic ,0.10000000000000002,positive
1447,thomasfaires,RT @TurnerJanelle: My 13 year old was just diagnosed with Hashimoto's Disease.  She's terrified that preexisting coverage will be taken awa…,rt turnerjanelle year old diagnosed hashimotos disease shes terrified preexisting coverage taken awa ,0.1,positive
1448,ShaninNewman1,"RT @KamalaHarris: Together, we will build our country back better than before.  It was an honor to make the case for @JoeBiden’s and my cam…",rt kamalaharris together build country back better honor make case joebiden cam ,0.25,positive
1449,CopilotDog,@smbwalker64 @JoeBiden Because he’ll be in jail,smbwalker joebiden jail,-0.1,negative
1450,JoergBS,"RT @glennkirschner2: How powerful, how valuable is your single vote for @JoeBiden? You will be VOTING OUT: Trump, Pence, Barr, Pompeo, DeVo…",rt glennkirschner powerful valuable single vote joebiden voting trump penny barr pompeo devo ,0.11428571428571428,positive
1451,BigFloppyHeart,RT @tatereeves: This may be the most ridiculous statement a candidate for President has made in 2020—and that is a high bar!  63 million Am…,rt tatereeves may ridiculous statement candidate president made high bar million ,-0.08666666666666666,negative
1452,kamalaboofsme,@JoeBiden I wish Joe woukd write these tweets and not some cleared framed lesbian feminist.,joebiden wish joe woukd write tweet cleared framed lesbian feminist,0.0,Neutral
1453,KatherineWhela4,"RT @KamalaHarris: Together, we will build our country back better than before.  It was an honor to make the case for @JoeBiden’s and my cam…",rt kamalaharris together build country back better honor make case joebiden cam ,0.25,positive
1454,JosephMesiano,RT @mariashriver: This is good for my mental health knowing that this man @JoeBiden will soon be leading us all forward. He will turn down…,rt mariashriver good mental health knowing man joebiden soon leading u forward turn ,0.3,positive
1455,Michael04007232,"RT @BernardKerik: I’m listening to @JoeBiden ramble about the slowed economic recovery, but he fails to tell the American people that it’s…",rt bernardkerik listening joebiden ramble slowed economic recovery fails tell american people ,-0.09999999999999999,negative
1456,ASmithBoomer,"RT @glennkirschner2: How powerful, how valuable is your single vote for @JoeBiden? You will be VOTING OUT: Trump, Pence, Barr, Pompeo, DeVo…",rt glennkirschner powerful valuable single vote joebiden voting trump penny barr pompeo devo ,0.11428571428571428,positive
1457,adamsmaryjo9,"RT @KamalaHarris: Together, we will build our country back better than before.  It was an honor to make the case for @JoeBiden’s and my cam…",rt kamalaharris together build country back better honor make case joebiden cam ,0.25,positive
1458,GuancheCanario,"RT @Condor_Law: Will anyone investigate #BidenCrimeFamily - Frank Biden’s $5 Billion Iraq deal, James Biden’s housing and Ukraine posh car…",rt condorlaw anyone investigate bidencrimefamily frank biden billion iraq deal james biden housing ukraine posh car ,0.0,Neutral
1459,hahail,RT @VicToensing: Nasty Democrat  #ChrisWallace criticized a real journalist @brithume for having “controversial view” re @JoeBiden being se…,rt victoensing nasty democrat chriswallace criticized real journalist brithume controversial view joebiden se ,-0.08333333333333333,negative
1460,HoneyOhannaTene,"@KamalaHarris @JoeBiden Endorse Ossoff &amp; Warnock, Trump is all over Georgia tv endorsing Loeffler.  I am tired of v… https://t.co/5rXHmKI3vF",kamalaharris joebiden endorse ossoff amp warnock trump georgia tv endorsing loeffler tired v httpstcorxhmkivf,-0.4,negative
1461,invierno57,"RT @KamalaHarris: Together, we will build our country back better than before.  It was an honor to make the case for @JoeBiden’s and my cam…",rt kamalaharris together build country back better honor make case joebiden cam ,0.25,positive
1462,LucyCarrDesigns,Need one more reason to feel good about voting Biden/Harris?  Here it is! https://t.co/5LVWH0MQft,need one reason feel good voting bidenharris httpstcolvwhmqft,0.7,positive
1463,ImrankhanPTIbk1,"RT @shubh19822: Back in 1992, Joe Biden made sure that India does not get access to cryogenic tech   #JoeBiden termed an Indo-Russia agreem…",rt shubh back joe biden made sure india get access cryogenic tech joebiden termed indorussia agreem ,0.25,positive
1464,rhfife,"RT @glennkirschner2: How powerful, how valuable is your single vote for @JoeBiden? You will be VOTING OUT: Trump, Pence, Barr, Pompeo, DeVo…",rt glennkirschner powerful valuable single vote joebiden voting trump penny barr pompeo devo ,0.11428571428571428,positive
1465,WillKowalski,"I see lots of high-profile former trump supporters now backing @JoeBiden.  Have any gone the other way, from Biden to trump?",see lot highprofile former trump supporter backing joebiden gone way biden trump,0.0,Neutral
1466,irabrock,RT @Emma_E_Riley: 🚨 NEWS: @PhillyInquirer endorses @JoeBiden and @KamalaHarris  “America can overcome the damage Donald Trump has wrought i…,rt emmaeriley news phillyinquirer endorses joebiden kamalaharris america overcome damage donald trump wrought ,0.0,Neutral
1467,claud712,"RT @KamalaHarris: Together, we will build our country back better than before.  It was an honor to make the case for @JoeBiden’s and my cam…",rt kamalaharris together build country back better honor make case joebiden cam ,0.25,positive
1468,BRussel39434804,"RT @glennkirschner2: How powerful, how valuable is your single vote for @JoeBiden? You will be VOTING OUT: Trump, Pence, Barr, Pompeo, DeVo…",rt glennkirschner powerful valuable single vote joebiden voting trump penny barr pompeo devo ,0.11428571428571428,positive
1469,agneschaplin,RT @RCamposDuffy: How utterly dishonest! .@JoeBiden tells Hispanic-Americans today that the reason 1 in 3 Latino-owned businesses have clos…,rt rcamposduffy utterly dishonest joebiden tell hispanicamericans today reason latinoowned business clos ,-0.3,negative
1470,carolshappylife,RT @BrianKarem: Good morning. In the news: the Taliban endorses @realDonaldTrump while Scientific American endorses @JoeBiden ... wait. Wha…,rt briankarem good morning news taliban endorses realdonaldtrump scientific american endorses joebiden wait wha ,0.35,positive
1471,Juanita_DeValle,"RT @KamalaHarris: Together, we will build our country back better than before.  It was an honor to make the case for @JoeBiden’s and my cam…",rt kamalaharris together build country back better honor make case joebiden cam ,0.25,positive
1472,1st_infantry,"RT @KamalaHarris: Together, we will build our country back better than before.  It was an honor to make the case for @JoeBiden’s and my cam…",rt kamalaharris together build country back better honor make case joebiden cam ,0.25,positive
1473,WolverineIron,"@JoeBiden As a hard working American myself, I know that while you were in Washington doing nothing, trump was hiri… https://t.co/GYSX1bi4PZ",joebiden hard working american know washington nothing trump hiri httpstcogysxbipz,-0.14583333333333334,negative
1474,Charlot21339406,"RT @KamalaHarris: Together, we will build our country back better than before.  It was an honor to make the case for @JoeBiden’s and my cam…",rt kamalaharris together build country back better honor make case joebiden cam ,0.25,positive
1475,TaylorNichol11,@sandra_larson7 @elijahwood @JoeBiden @KamalaHarris Almost guarantee someone in Nd is gonna torch this when they see it,sandralarson elijahwood joebiden kamalaharris almost guarantee someone nd gonna torch see,0.0,Neutral
1476,PMasalsky,RT @BrianKarem: Good morning. In the news: the Taliban endorses @realDonaldTrump while Scientific American endorses @JoeBiden ... wait. Wha…,rt briankarem good morning news taliban endorses realdonaldtrump scientific american endorses joebiden wait wha ,0.35,positive
1477,Emanate828,@IAmSophiaNelson @jaketapper @JoeBiden Yes!!! @jaketapper Stop trying to score Sunday morning news show “bites” / drama!! It’s pathetic...,iamsophianelson jaketapper joebiden yes jaketapper stop trying score sunday morning news show bite drama pathetic,-1.0,negative
1478,dchudi187,RT @ikehaji: .@JoeBiden has now campaigned in all four corners of Pennsylvania.   In every single Pennsylvania media market.   In PA counti…,rt ikehaji joebiden campaigned four corner pennsylvania every single pennsylvania medium market pa counti ,-0.07142857142857142,negative
1479,TheGamb10,@PamelaGeller @JoeBiden He was undoubtedly paid to say that. Good and intelligent American Vets hate Israel and not… https://t.co/DXg0T1oGzc,pamelageller joebiden undoubtedly paid say good intelligent american vet hate israel httpstcodxgtogzc,0.175,positive
1480,DawnBraun66,RT @RCamposDuffy: How utterly dishonest! .@JoeBiden tells Hispanic-Americans today that the reason 1 in 3 Latino-owned businesses have clos…,rt rcamposduffy utterly dishonest joebiden tell hispanicamericans today reason latinoowned business clos ,-0.3,negative
1481,jami737,"RT @FloridaForBiden: 🚨Endorsement Alert🚨 Climate activist @GretaThunberg urges supporters to vote Biden! Whether you supported @JoeBiden, @…",rt floridaforbiden endorsement alert climate activist gretathunberg urge supporter vote biden whether supported joebiden ,0.0,Neutral
1482,DreTop1a,"RT @JeriLRyan: We must build a better future for the next generation. Join me, Star Trek cast, &amp; Trekkies - @StaceyAbrams, @CoryBooker, @An…",rt jerilryan must build better future next generation join star trek cast amp trekkies staceyabrams corybooker ,0.16666666666666666,positive
1483,stayintouchDB,RT @fred_guttenberg: This rising COVID trend was both PREDICTABLE and PREVENTABLE.   This rising trend is the fault of this administration…,rt fredguttenberg rising covid trend predictable preventable rising trend fault administration ,-0.2,negative
1484,CelloArtist,"@Kimgtrue2me @JoeBiden @PreetBharara Super irresponsible, super full of himself, super dishonest, super womanizer,… https://t.co/0vVn0kUROJ",kimgtrueme joebiden preetbharara super irresponsible super full super dishonest super womanizer httpstcovvnkuroj,0.2305555555555555,positive
1485,LMishik,"RT @KamalaHarris: Together, we will build our country back better than before.  It was an honor to make the case for @JoeBiden’s and my cam…",rt kamalaharris together build country back better honor make case joebiden cam ,0.25,positive
1486,bobbythebank,@JoeBidenburns @JoeBiden Lies,joebidenburns joebiden lie,0.0,Neutral
1487,BHathaway11,"RT @KamalaHarris: Together, we will build our country back better than before.  It was an honor to make the case for @JoeBiden’s and my cam…",rt kamalaharris together build country back better honor make case joebiden cam ,0.25,positive
1488,AlexEReynolds,@DaTechGuyblog @guypbenson @POTUS @realDonaldTrump @JoeBiden I never said anything about Trump.,datechguyblog guypbenson potus realdonaldtrump joebiden never said anything trump,0.0,Neutral
1489,singhash,RT @charliekirk11: How many people does ANTIFA have to murder in cold blood before Democrats even acknowledge they exist &amp; they’re a proble…,rt charliekirk many people antifa murder cold blood democrat even acknowledge exist amp proble ,-0.04999999999999999,negative
1490,kakanicat,"RT @PamShumate59: @jeneps No @JoeBiden, we knew exactly what you meant and you owe ZERO explanations to anyone in the media..Until they foc…",rt pamshumate jeneps joebiden knew exactly meant owe zero explanation anyone mediauntil foc ,0.25,positive
1491,mamablank,RT @VoLinxx: This new @JoeBiden @KamalaHarris Advertisement featuring 14 Black mayors from across the country is amazing. Show up. Show out…,rt volinxx new joebiden kamalaharris advertisement featuring black mayor across country amazing show show ,0.18989898989898993,positive
1492,roady13,@smbwalker64 @JoeBiden Well he probably wouldn’t be able to get a pass out of prison for that day! Who would invite… https://t.co/1yA059ohsk,smbwalker joebiden well probably able get pas prison day would invite httpstcoyaohsk,0.5,positive
1493,KeithLavoie13,"RT @KamalaHarris: Together, we will build our country back better than before.  It was an honor to make the case for @JoeBiden’s and my cam…",rt kamalaharris together build country back better honor make case joebiden cam ,0.25,positive
1494,enri0960,"RT @glennkirschner2: How powerful, how valuable is your single vote for @JoeBiden? You will be VOTING OUT: Trump, Pence, Barr, Pompeo, DeVo…",rt glennkirschner powerful valuable single vote joebiden voting trump penny barr pompeo devo ,0.11428571428571428,positive
1495,BroMetalorg,RT @fred_guttenberg: This headline says it all.  Trump voters only believe his lies and put others at risk.  All other voters believe facts…,rt fredguttenberg headline say trump voter believe lie put others risk voter believe fact ,0.0,Neutral
1496,jaquelinehogreb,"RT @glennkirschner2: How powerful, how valuable is your single vote for @JoeBiden? You will be VOTING OUT: Trump, Pence, Barr, Pompeo, DeVo…",rt glennkirschner powerful valuable single vote joebiden voting trump penny barr pompeo devo ,0.11428571428571428,positive
1497,kenm77,RT @fred_guttenberg: This rising COVID trend was both PREDICTABLE and PREVENTABLE.   This rising trend is the fault of this administration…,rt fredguttenberg rising covid trend predictable preventable rising trend fault administration ,-0.2,negative
1498,mikefrontrange,"RT @glennkirschner2: How powerful, how valuable is your single vote for @JoeBiden? You will be VOTING OUT: Trump, Pence, Barr, Pompeo, DeVo…",rt glennkirschner powerful valuable single vote joebiden voting trump penny barr pompeo devo ,0.11428571428571428,positive
1499,DMichael239,@JoeBiden Lets get this cash🥳,joebiden let get cash ,0.0,Neutral
1500,btjlda,@JoeBiden We need a president who doesn’t take bribes from other countries for themselves and family members   #Trump2020,joebiden need president take bribe country family member trump,0.0,Neutral
1501,ronlaskey,@JoeBiden You lost me at understands.,joebiden lost understands,0.0,Neutral
1502,beckyjohnson55,RT @VicToensing: Nasty Democrat  #ChrisWallace criticized a real journalist @brithume for having “controversial view” re @JoeBiden being se…,rt victoensing nasty democrat chriswallace criticized real journalist brithume controversial view joebiden se ,-0.08333333333333333,negative
1503,tracyk726,RT @fred_guttenberg: This rising COVID trend was both PREDICTABLE and PREVENTABLE.   This rising trend is the fault of this administration…,rt fredguttenberg rising covid trend predictable preventable rising trend fault administration ,-0.2,negative
1504,Rideshorses,RT @charliekirk11: How many people does ANTIFA have to murder in cold blood before Democrats even acknowledge they exist &amp; they’re a proble…,rt charliekirk many people antifa murder cold blood democrat even acknowledge exist amp proble ,-0.04999999999999999,negative
1505,The_Red_Mask_1,@JoeBiden and @KamalaHarris are #cowards if they cannot answer a si  yes or no question! #WeThePeopleDeserveToKnow,joebiden kamalaharris coward cannot answer si yes question wethepeopledeservetoknow,0.0,Neutral
1506,dhlockwood,RT @BrianKarem: Good morning. In the news: the Taliban endorses @realDonaldTrump while Scientific American endorses @JoeBiden ... wait. Wha…,rt briankarem good morning news taliban endorses realdonaldtrump scientific american endorses joebiden wait wha ,0.35,positive
1507,jc99228698,@KamalaHarris @JoeBiden You made the case why you will never be elected vice president,kamalaharris joebiden made case never elected vice president,0.0,Neutral
1508,Ralph_R_Allen,"RT @glennkirschner2: How powerful, how valuable is your single vote for @JoeBiden? You will be VOTING OUT: Trump, Pence, Barr, Pompeo, DeVo…",rt glennkirschner powerful valuable single vote joebiden voting trump penny barr pompeo devo ,0.11428571428571428,positive
1509,DmamaWes,RT @SaraCarterDC: #TheSaraCarterShow: No one is asking @JoeBiden about #HunterBiden  It's highly suspicious and seemingly unethical what he…,rt saracarterdc thesaracartershow one asking joebiden hunterbiden highly suspicious seemingly unethical ,0.16,positive
1510,JGurath,@JoeBiden We need to actually have hard working Americans not one who destroys their livelihoods by sending the them overseas.,joebiden need actually hard working american one destroys livelihood sending overseas,-0.14583333333333334,negative
1511,DTRH33,The best thing is that the Liberals are now saying something that is constitutional and the duty of the president i… https://t.co/KCVcVKRPp2,best thing liberal saying something constitutional duty president httpstcokcvcvkrpp,1.0,positive
1512,tellthetruth199,@BlackTeaBlog @FlorioGina @RealCandaceO @YouTube Black and brown people face Medical Systemic Racism abusive or lac… https://t.co/gMmLJfHmYw,blackteablog floriogina realcandaceo youtube black brown people face medical systemic racism abusive lac httpstcogmmljfhmyw,-0.08333333333333333,negative
1513,Dadaroo,@BHForsyth @JoeBiden Enough that he paid more in federal taxes last year than your boy did in the past 2 decades!,bhforsyth joebiden enough paid federal tax last year boy past decade,-0.08333333333333333,negative
1514,realSaintTroll,@RoxyinLQ @Death2Tyrants84 @WalshFreedom @realDonaldTrump @JoeBiden No it's not.  Ask rioting BLMs which party they… https://t.co/qMvfNzh1fY,roxyinlq deathtyrants walshfreedom realdonaldtrump joebiden ask rioting blms party httpstcoqmvfnzhfy,0.0,Neutral
1515,srzjwalters,@JoeBiden  @SenKamalaHarris ..prepare oil workers a cleaner place to work and do business! You’ll see! https://t.co/R4TXUsYFTv,joebiden senkamalaharris prepare oil worker cleaner place work business see httpstcortxusyftv,0.0,Neutral
1516,SeraphXeno,@JoeBiden Abstraction is not a plan,joebiden abstraction plan,0.0,Neutral
1517,racetrackandy,RT @VicToensing: Nasty Democrat  #ChrisWallace criticized a real journalist @brithume for having “controversial view” re @JoeBiden being se…,rt victoensing nasty democrat chriswallace criticized real journalist brithume controversial view joebiden se ,-0.08333333333333333,negative
1518,PapillonLvr,"RT @pollsofpolitics: Who will be the next #POTUS, @realDonaldTrump, @JoeBiden or @Jorgensen4POTUS??  Please vote and retweet to spread poll…",rt pollsofpolitics next potus realdonaldtrump joebiden jorgensenpotus please vote retweet spread poll ,0.0,Neutral
1519,TonyaJo99623078,"RT @KamalaHarris: Together, we will build our country back better than before.  It was an honor to make the case for @JoeBiden’s and my cam…",rt kamalaharris together build country back better honor make case joebiden cam ,0.25,positive
1520,jkorkie,RT @mariashriver: This is good for my mental health knowing that this man @JoeBiden will soon be leading us all forward. He will turn down…,rt mariashriver good mental health knowing man joebiden soon leading u forward turn ,0.3,positive
1521,gk_titto,RT @classicbuyers: @SYR98009620 @CPBlr @BlrCityPolice @FBI @TheJusticeDept @FBIChicago @HardeepSPuri @NDILnews @AmitShah @dir_ed @ips_patil…,rt classicbuyers syr cpblr blrcitypolice fbi thejusticedept fbichicago hardeepspuri ndilnews amitshah dired ipspatil ,0.0,Neutral
1522,pavlova11171,"RT @KamalaHarris: Together, we will build our country back better than before.  It was an honor to make the case for @JoeBiden’s and my cam…",rt kamalaharris together build country back better honor make case joebiden cam ,0.25,positive
1523,JadedAkAEcho,"RT @KamalaHarris: Together, we will build our country back better than before.  It was an honor to make the case for @JoeBiden’s and my cam…",rt kamalaharris together build country back better honor make case joebiden cam ,0.25,positive
1524,davidstringer11,"@my3monkees @DanRather Hell, why can't we pack it with 535 Justices?? Wait, that is the U.S. Senate and the U.S. Ho… https://t.co/eRWijfduKB",mymonkees danrather hell cant pack justice wait u senate u ho httpstcoerwijfdukb,0.0,Neutral
1525,Dummiehead2,@Recla @charliekirk11 @JoeBiden Why not just get rid of the head of antifa?  Idiot,recla charliekirk joebiden get rid head antifa idiot,-0.8,negative
1526,EatonSenator,"RT @KamalaHarris: Together, we will build our country back better than before.  It was an honor to make the case for @JoeBiden’s and my cam…",rt kamalaharris together build country back better honor make case joebiden cam ,0.25,positive
1527,TX_MAW,RT @VicToensing: Nasty Democrat  #ChrisWallace criticized a real journalist @brithume for having “controversial view” re @JoeBiden being se…,rt victoensing nasty democrat chriswallace criticized real journalist brithume controversial view joebiden se ,-0.08333333333333333,negative
1528,Imaginpc2day,"RT @WalshFreedom: I’m a conservative. I believe @realDonaldTrump is unfit. Therefore, I’m voting for the ONLY person who can beat Trump, @J…",rt walshfreedom conservative believe realdonaldtrump unfit therefore voting person beat trump j ,0.0,Neutral
1529,OMAROSA,@MurielBowser @JoeBiden @KamalaHarris powerful,murielbowser joebiden kamalaharris powerful,0.3,positive
1530,ckaminoff,"RT @KamalaHarris: Together, we will build our country back better than before.  It was an honor to make the case for @JoeBiden’s and my cam…",rt kamalaharris together build country back better honor make case joebiden cam ,0.25,positive
1531,vjhoff57,"RT @DrDenaGrayson: @thespybrief It’s not “over” with more than 3 weeks to go, but @JoeBiden does appear to be banking an early vote lead th…",rt drdenagrayson thespybrief week go joebiden appear banking early vote lead th ,0.1,positive
1532,cynicked,"RT @glennkirschner2: How powerful, how valuable is your single vote for @JoeBiden? You will be VOTING OUT: Trump, Pence, Barr, Pompeo, DeVo…",rt glennkirschner powerful valuable single vote joebiden voting trump penny barr pompeo devo ,0.11428571428571428,positive
1533,RaleighSking,RT @KaivanShroff: Scientific American never backed a presidential candidate before 2020.   They endorsed @JoeBiden.   The Taliban have also…,rt kaivanshroff scientific american never backed presidential candidate endorsed joebiden taliban also ,0.0,Neutral
1534,jerzeygirl99,"RT @julianzelizer: Just to be clear, conservatives are complaining that @JoeBiden won’t take a position on changing the size of SCOTUS—whic…",rt julianzelizer clear conservative complaining joebiden take position changing size scotus whic ,0.10000000000000002,positive
1535,Karen33761340,RT @charliekirk11: How many people does ANTIFA have to murder in cold blood before Democrats even acknowledge they exist &amp; they’re a proble…,rt charliekirk many people antifa murder cold blood democrat even acknowledge exist amp proble ,-0.04999999999999999,negative
1536,a_friend_1970,"RT @KamalaHarris: Together, we will build our country back better than before.  It was an honor to make the case for @JoeBiden’s and my cam…",rt kamalaharris together build country back better honor make case joebiden cam ,0.25,positive
1537,_FallingSlowly_,"RT @glennkirschner2: How powerful, how valuable is your single vote for @JoeBiden? You will be VOTING OUT: Trump, Pence, Barr, Pompeo, DeVo…",rt glennkirschner powerful valuable single vote joebiden voting trump penny barr pompeo devo ,0.11428571428571428,positive
1538,carolbusche,"RT @hodgetwins: Joe Biden....your ""idea"" just murdered somebody in Denver. @JoeBiden @KamalaHarris",rt hodgetwins joe bidenyour idea murdered somebody denver joebiden kamalaharris,0.0,Neutral
